{
  "version": "0.2.0-seed",
  "last_reviewed": "2026-05-30",
  "scope_note": "Curated seed list of public OSINT and public-record sources for J-Stack routing. It is not exhaustive, not legal advice, and not permission to scrape, bypass access controls, or publish sensitive personal data. Verify each source's current terms, license, and official status before use.",
  "sources": [
    {
      "id": "opencorporates",
      "name": "OpenCorporates",
      "category": "company-registers",
      "jurisdiction": "global",
      "url": "https://opencorporates.com/",
      "access": "mixed",
      "automation": "manual-first",
      "license_tos": "Check OpenCorporates terms and API terms before automated use.",
      "data_types": [
        "company profiles",
        "officers",
        "filings index",
        "jurisdiction links"
      ],
      "best_for": "Cross-jurisdiction company discovery and officer/entity leads.",
      "caution": "Often an index into official registers; verify material facts at the original registry.",
      "personal_data_risk": "medium",
      "evidence_weight": "index",
      "citation_note": "Cite the official registry for final assertions when available; cite OpenCorporates as an index.",
      "tags": [
        "company-register",
        "entity",
        "beneficial-ownership",
        "global"
      ]
    },
    {
      "id": "gleif-lei-search",
      "name": "GLEIF LEI Search",
      "category": "company-registers",
      "jurisdiction": "global",
      "url": "https://search.gleif.org/",
      "access": "free-public",
      "automation": "api-preferred",
      "license_tos": "GLEIF publishes LEI data under its stated open-data terms; check current license before reuse.",
      "data_types": [
        "LEI records",
        "legal names",
        "registered addresses",
        "parent relationships"
      ],
      "best_for": "Identifying legal entities and corporate hierarchy via LEI records.",
      "caution": "LEI coverage is incomplete and concentrated among financial/regulated entities.",
      "personal_data_risk": "medium",
      "evidence_weight": "primary",
      "citation_note": "Cite LEI and registration status with retrieval date.",
      "tags": [
        "company-register",
        "entity",
        "lei",
        "global"
      ]
    },
    {
      "id": "uk-companies-house",
      "name": "UK Companies House Find and update company information",
      "category": "company-registers",
      "jurisdiction": "United Kingdom",
      "url": "https://find-and-update.company-information.service.gov.uk/",
      "access": "free-public",
      "automation": "api-preferred",
      "license_tos": "Use Companies House API and website terms; documents may contain personal data.",
      "data_types": [
        "company filings",
        "officers",
        "PSC records",
        "accounts"
      ],
      "best_for": "UK company identity, filings, directors, PSC records, charges, accounts.",
      "caution": "Identity matches need corroboration; officer addresses and birthdays are sensitive.",
      "personal_data_risk": "high",
      "evidence_weight": "primary",
      "citation_note": "Cite company number, filing date, document type, and retrieval date.",
      "tags": [
        "company-register",
        "filings",
        "uk",
        "beneficial-ownership"
      ]
    },
    {
      "id": "sec-edgar",
      "name": "SEC EDGAR",
      "category": "company-filings",
      "jurisdiction": "United States",
      "url": "https://www.sec.gov/edgar/search/",
      "access": "free-public",
      "automation": "api-preferred",
      "license_tos": "Follow SEC fair-access and bulk-download guidance.",
      "data_types": [
        "issuer filings",
        "10-K",
        "10-Q",
        "8-K",
        "ownership forms"
      ],
      "best_for": "US public-company disclosures and regulated filings.",
      "caution": "SEC filings are issuer/legal disclosures, not independent proof of every factual assertion.",
      "personal_data_risk": "medium",
      "evidence_weight": "primary",
      "citation_note": "Cite accession number, form type, filing date, and exhibit where applicable.",
      "tags": [
        "company-filings",
        "securities",
        "us",
        "primary-source"
      ]
    },
    {
      "id": "canada-sedar-plus",
      "name": "SEDAR+",
      "category": "company-filings",
      "jurisdiction": "Canada",
      "url": "https://www.sedarplus.ca/",
      "access": "free-public",
      "automation": "manual-first",
      "license_tos": "Check SEDAR+ terms and securities-regulator guidance.",
      "data_types": [
        "issuer filings",
        "prospectuses",
        "continuous disclosure"
      ],
      "best_for": "Canadian public issuer filings.",
      "caution": "Coverage and document availability differ by issuer and filing type.",
      "personal_data_risk": "medium",
      "evidence_weight": "primary",
      "citation_note": "Cite issuer, filing type, date, and regulator record.",
      "tags": [
        "company-filings",
        "securities",
        "canada"
      ]
    },
    {
      "id": "japan-edinet",
      "name": "EDINET",
      "category": "company-filings",
      "jurisdiction": "Japan",
      "url": "https://disclosure2.edinet-fsa.go.jp/",
      "access": "free-public",
      "automation": "manual-first",
      "license_tos": "Check FSA EDINET access terms and language limitations.",
      "data_types": [
        "securities reports",
        "disclosure documents"
      ],
      "best_for": "Japanese securities filings and issuer disclosure.",
      "caution": "Japanese-language source; translation risk must be recorded.",
      "personal_data_risk": "medium",
      "evidence_weight": "primary",
      "citation_note": "Cite EDINET document, issuer, and filing date.",
      "tags": [
        "company-filings",
        "securities",
        "japan",
        "translation-risk"
      ]
    },
    {
      "id": "germany-unternehmensregister",
      "name": "Unternehmensregister",
      "category": "company-registers",
      "jurisdiction": "Germany",
      "url": "https://www.unternehmensregister.de/",
      "access": "free-public",
      "automation": "manual-first",
      "license_tos": "Check portal terms; some documents or extracts may have access restrictions.",
      "data_types": [
        "company notices",
        "annual accounts",
        "register publications"
      ],
      "best_for": "German company publications and financial statements.",
      "caution": "Portal is authoritative for publications but may not replace Handelsregister extracts.",
      "personal_data_risk": "medium",
      "evidence_weight": "primary",
      "citation_note": "Cite company, publication type, date, and register reference.",
      "tags": [
        "company-register",
        "filings",
        "germany"
      ]
    },
    {
      "id": "germany-handelsregister",
      "name": "Handelsregister",
      "category": "company-registers",
      "jurisdiction": "Germany",
      "url": "https://www.handelsregister.de/",
      "access": "mixed",
      "automation": "manual-first",
      "license_tos": "Check official portal terms and fees; do not bypass access controls.",
      "data_types": [
        "register extracts",
        "company officers",
        "corporate events"
      ],
      "best_for": "German commercial-register facts.",
      "caution": "Some documents may require paid retrieval; personal data minimization required.",
      "personal_data_risk": "high",
      "evidence_weight": "primary",
      "citation_note": "Cite register court, register number, document type, and retrieval date.",
      "tags": [
        "company-register",
        "filings",
        "germany",
        "primary-source"
      ]
    },
    {
      "id": "panama-registro-publico",
      "name": "Registro Público de Panamá",
      "category": "company-registers",
      "jurisdiction": "Panama",
      "url": "https://www.rp.gob.pa/",
      "access": "mixed",
      "automation": "manual-first",
      "license_tos": "Use official registry access rules; paid or account-based extracts may apply.",
      "data_types": [
        "company records",
        "property records",
        "registry filings"
      ],
      "best_for": "Panama public registry leads and official extracts where available.",
      "caution": "Do not infer beneficial ownership or control solely from names; verify extracts.",
      "personal_data_risk": "high",
      "evidence_weight": "primary",
      "citation_note": "Cite official entry/extract identifiers and retrieval date.",
      "tags": [
        "company-register",
        "property",
        "panama",
        "primary-source"
      ]
    },
    {
      "id": "australia-asic-registers",
      "name": "ASIC Registers",
      "category": "company-registers",
      "jurisdiction": "Australia",
      "url": "https://asic.gov.au/online-services/search-asics-registers/",
      "access": "mixed",
      "automation": "manual-first",
      "license_tos": "Check ASIC search terms and fee rules.",
      "data_types": [
        "company records",
        "business names",
        "professional registers"
      ],
      "best_for": "Australian companies and registered business names.",
      "caution": "Some details require paid extracts; identity matches need corroboration.",
      "personal_data_risk": "medium",
      "evidence_weight": "primary",
      "citation_note": "Cite ACN/ABN, register record, and retrieval date.",
      "tags": [
        "company-register",
        "australia"
      ]
    },
    {
      "id": "new-zealand-companies-register",
      "name": "New Zealand Companies Register",
      "category": "company-registers",
      "jurisdiction": "New Zealand",
      "url": "https://companies-register.companiesoffice.govt.nz/",
      "access": "free-public",
      "automation": "manual-first",